Sequence #,Field name,Field description,Controlled value choices
10,Observation_ID,"The unique identifier of each phenophase status record (subsequently refered to as ""status record"") in the database.",
20,Dataset_ID,"The unique identifier of the dataset to which the status record belongs.  More information can be found in the ancillary data file for ""Dataset"". A value of ""-9999"" indicates the status record was submitted via the online Nature's Notebook application.",
30,ObservedBy_Person_ID,"The unique identifier of the person who made the status observation in the field. More information can be found in the ancillary data file for ""Person"". A value of ""-1"" indicates the identity of the observer is unknown. ",
40,Submission_ID,"The unique identifier of the set of status records originally submitted online in the same, single click of the ""Submit Observations"" button, to which this status record belongs. A value of ""-1"" indicates the record was added to the database as part of an integrated dataset.",
50,SubmittedBy_Person_ID,"The unique identifier of the person who originally submitted the status record online. More information can be found in the ancillary data file for ""Person"".  A value of ""-1"" indicates the record was added to the database as part of an integrated dataset. ",
60,Submission_Datetime,The date and time that the status record was originally sumbitted to the database.,
70,UpdatedBy_Person_ID,"The unique identifier of the person who last updated the status record after original submission online. More information can be found in the ancillary data file for ""Person"". A value of ""-9999"" indicates the record has not been updated since this field was established in July 2014.",
80,Update_Datetime,"The date and time the status record was last updated after original submission online. A value of ""-9999"" indicates the record has not been updated since this field was established in July 2014.",
90,Partner_Group,"The name of the partner group with which the status record is associated.  A value of ""-9999"" indicates the organism being monitored is not associated with a partner group. ",
100,Site_ID,"The unique identifier of the site at which the status record was made. More information can be found in the ancillary data file for ""Site"".",
110,Site_Name,The user-defined name of the site at which the status record was made.,
120,Latitude,"The latitude of the site at which the status record was made. Generally lat/long is calculated from the Google Maps API with a datum of WGS84 (https://developers.google.com/maps), unless a plausible user-defined lat/long was submitted. Information about the datum and source of the lat/long value can be found in the ""Site"" ancillary data file. ",
130,Longitude,"The longitude of the site at which the status record was made. Generally lat/long is calculated from the Google Maps API with a datum of WGS84 (https://developers.google.com/maps), unless a plausible user-defined lat/long was submitted. Information about the datum and source of the lat/long value can be found in the ""Site"" ancillary data file. ",
140,Elevation_in_Meters,"The elevation (in meters) of the site at which the status record was made. Generally elevation is calculated from the Google Maps Elevation API (https://developers.google.com/maps/documentation/elevation/intro), unless a plausible user-defined elevation was submitted. Information about the source of the elevation value can be found in the ""Site"" ancillary data file. A value of ""-9999"" indicates the elevation could not be calculated.",
150,State,"The U.S. state or territory, Mexican state or Canadian province in which the site is located. The state is calculated from lat/long by the Google Maps Geocoding API (https://developers.google.com/maps/documentation/geocoding/intro). A value of ""-9999"" indicates the site does not fall within the boundaries of North America.",
160,Species_ID,The unique identifier of the species for which the status record was made.,
170,Genus,The taxonomic genus of the organism for which the status record was made. Taxonomy follows that in the Integrated Taxonomic Information System (http://itis.gov).,
180,Species,"The taxonomic species of the organism for which the status record was made. Taxonomy follows that in the Integrated Taxonomic Information System (http://itis.gov). In those rare cases where a taxonomic subspecies or varietal is designated, the subspecies or varietal name is appended to the species name after a hypen (e.g. Cornus florida-appalachianspring).",
190,Common_Name,"The common name of the species for which the status record was made. Common names for plants follow those in the USDA PLANTS Database (http://plants.usda.gov), and for animals, in the NatureServe database (http://explorer.natureserve.org).",
200,Kingdom,The taxonomic kingdom of the organism for which the status record was made.,Plantae|Animalia
210,Species_Functional_Type,"The plant ecological type or animal guild of the species for which the status record was made. These functional types are based on the species' phenology protocol assignment, and in a few cases do not correspond with a plant species' established botanical classification (e.g. sub-shrubs that grow more like forbs because woody parts are belowground). Definitions for plant functional types are available at https://docs.google.com/document/d/1eavZ5UzZxiRmfxlmA6t023Z1UD1ggzPbjxBBjPynB0E/pub","Algae|Amphibian|Bird|Cactus|Deciduous broadleaf [tree or shrub]|Deciduous conifer|Evergreen broadleaf [tree or shrub]|Evergreen conifer|Fish|Forb|Graminoid [includes grasses, sedges and rushes]|Insect|Mammal|Reptile|Drought deciduous broadleaf [tree or shrub]|Pine|Semi-evergreen broadleaf [tree or shrub]|Evergreen forb|Semi-evergreen forb"
220,Species_Category,The categories (separated by commas) to which the species has been assigned. Assignment to these categories is primarily to facilitate finding species of interest on the Nature's Notebook Plants and Animals search page and in the Phenology Observation Portal and Visualization Tool.,Allergen [for plants in a genus listed as having species that are moderate or severe allergens in the Pollen Library database (http://pollenlibrary.com)]|Aquatic [for plants listed as an obligate wetland species in the USDA PLANTS Database (http://plants.usda.gov)]|Calibration [for plants that were part of the original set of USA-NPN calibration species]|Cloned [for plants in the USA-NPN's Cloned Plants Project]|Crop [for plants that are considered crops for human consumption]|Green Wave Campaign [for plants included in this Nature's Notebook campaign]|Invasive [for plants and animals listed as invasive over much of their US range in the Center for Invasive Species and Ecosystem Health database (http://invasive.org)]|Ornamental [for plants commonly used as horticultural ornamentals]|Nectar Connectors Campaign [for plants included in this Nature's Notebook campaign]|Southwest Season Trackers Campaign [for plants included in this Nature's Notebook campaign]|Shady Invaders Campaign [for plants included in this Nature's Notebook campaign]|Flowers for Bats Campaign [for plants included in this Nature's Notebook campaign]
224,Lifecycle_Duration,The possible lifecycle durations of the species for which the status record was made. This information is only included for plant species and is gathered from the USDA PLANTS Database (http://plants.usda.gov).,
226,Growth_Habit,The possible growth habits of the species for which the status record was made. This information is only included for plant species and is gathered from the USDA PLANTS Database (http://plants.usda.gov).,
230,USDA_PLANTS_Symbol,The USDA PLANTS Database (http://plants.usda.gov) symbol of the species for which the status record was made.,
240,ITIS_Number,The Integrated Taxonomic Information System (http://itis.gov) taxonomic serial number of the species for which the status record was made.,
250,Individual_ID,"The unique identifier of the individual plant or the animal species at a site for which the status record was made. Note that for plants, individuals are tracked separately, while for animals, the species as a whole (rather than unique individuals) is tracked at a site. More information can be found in the ancillary data file for ""Individual Plant"".",
260,Plant_Nickname,"The user-defined nickname of the individual plant for which the status record was made. For animals, this field is populated with the species' common name.",
270,Patch,"For plants, indicates whether a delineated patch of many individial stems is the unit of observation instead of a single individual plant.",1 [yes]
280,Protocol_ID,"The unique identifier of the protocol (i.e. the unique suite of phenophases) assigned to the species at the time the status observation was made in the field. More information can be found in the ancillary data files for ""Protocol"" and ""Species Protocol"".",
290,Phenophase_ID,"The unique identifier of the phenophase for which the status record was made. Note that there can be several names and definitions for a given phenophase as they vary between datasets and can change over time within datasets. All definitions lumped under the same Phenophase_ID are considered equivalent for the purposes of general phenological analysis. More information can be found in the ancillary data files for ""Phenophase"" and ""Phenophase Definition"".",
300,Phenophase_Category,The overarching life stage category of the phenophase for which the status record was made. Each category includes all phenophases across all plant or animal taxa that target that life stage.,Leaves [for plants]|Flowers [for plants]|Fruits [for plants]|Needles [for plants]|Pollen cones [for plants]|Seed cones [for plants]|Activity [for animals]|Reproduction [for animals]|Development [for animals]|Method [for animals]
310,Phenophase_Description,"The descriptive title of the phenophase for which the status record was made. This is the overarching title of the phenophase defined by Phenophase_ID, and may include several different names and definitions (as defined in the Phenophase_Name and Phenophase_Definition_ID fields), as these vary between datasets and can change over time within datasets. More information can be found in the ancillary data file for ""Phenophase"".",
320,Phenophase_Name,The name used to describe the phenophase at the time the status observation was made in the field. ,
330,Phenophase_Definition_ID,"The unique identifier of the descriptive definition used to define the phenophase at the time the status observation was made in the field. More information can be found in the ancillary data files for ""Phenophase"" and ""Phenophase Definition"".",
340,Species-Specific_Info_ID,"The unique identifier of the record which includes species-specific information (additional, species-specific phenophase definition and/or intensity category) assigned to the phenophase for this species at the time the status observation was made in the field. A value of ""-9999"" indicates there was no species-specific information assigned to this phenophase for this species at the time the observation was made. More information can be found in the ancillary data file for"" Species-Specific Information"".",
350,Observation_Date,The date the status observation was made in the field.,
360,Observation_Time,"The time of day the status observation was made in the field. A value of ""0:00:00"" indicates either that no time was specified, or that the time of midnight was reported.",
370,Day_of_Year,"The day of year, ranging from 1 to 366, that the status observation was made in the field.",
380,Phenophase_Status,The status (i.e. presence or absence) of the phenophase at the time the observation was made in the field.,"1 [""yes the phenophase is occuring""]|0 [""no the phenophase is not occuring""]|-1 [""not certain whether the phenophase is occuring""]"
390,Intensity_Category_ID,"The unique identifier of the intensity category assigned to the phenophase for this species at the time the status observation was made in the field. Intensity measures allow reporting of the degree to which a phenophase is expressed. More information can be found in the ancillary data file for ""Intensity"". A value of ""-9999"" indicates there was no intensity category assigned to this phenophase for this species at the time the observation was made.",
410,Intensity_Value,"The value reported in response to the intensity category question assigned to the phenophase for this species at the time the status observation was made in the field. The list of allowable responses for this intensity category question can be found in the ancillary data file for ""Intensity"".",
420,Abundance_Value,"Used only for animal observations, the value reported in response to the instruction, ""enter the number of individual animals observed in this phenophase"".",
430,Site_Visit_ID,"The unique identifier for the group of all status observations made at the site during the same visit. Information about survey time, methods, and site conditions at the time of the visit can be found in the ancillary data file for ""Site Visit"".",
440,Observation_Comments,Comments from the observer about the individual plant or animal species at the time the status observation was made in the field.,
450,Observed_Status_Conflict_Flag,"Indicates the presence and type of conflict (i.e. reported Phenophase_Status of both ""yes"" and ""no"" on the same observation date) between this and at least one other phenophase status record for this same individual plant or animal species at this site.",MultiObserver-StatusConflict|OneObserver-StatusConflict
460,Status_Conflict_Related_Records,The Observation_ID numbers (separated by commas) for other records involved in a phenophase status conflict with this record.,
470,AGDD,"Accumulated growing degree days (in degrees Celsius) on the Observation_Date. This is the sum of growing degree days (GDD) since January 1st, where GDD is calculated as the number of degrees C by which each day's average temperature exceeds 0 degrees C (i.e., (Tmax + Tmin)/2 - 0 degrees C). From Daymet (http://daymet.ornl.gov).",
480,AGDD_in_F,"Accumulated growing degree days (in degrees Fahrenheit) on the Observation_Date. This is the sum of growing degree days (GDD) since January 1st, where GDD is calculated as the number of degrees F by which each day's average temperature exceeds 32 degrees F (i.e., (Tmax + Tmin)/2 - 32 degrees F). From Daymet (http://daymet.ornl.gov).",
490,Tmax_Winter,Average maximum temperature (in degrees C) for the winter season of the year of the Observation_Date (December of previous year to February of the year of the Observation_Date). From Daymet (http://daymet.ornl.gov).,
500,Tmax_Spring,Average maximum temperature (in degrees C) for the spring season of the year of the Observation_Date (March-May). From Daymet (http://daymet.ornl.gov).,
510,Tmax_Summer,Average maximum temperature (in degrees C) for the summer season of the year of the Observation_Date (June-August). From Daymet (http://daymet.ornl.gov).,
520,Tmax_Fall,"Average maximum temperature (in degrees C) for the previous year's fall season (September-November), relative to the year of the Observation_Date. From Daymet (http://daymet.ornl.gov).",
530,Tmax,Maximum temperature (in degrees C) on the Observation_Date. From Daymet (http://daymet.ornl.gov).,
540,Tmax_in_F,Maximum temperature (in degrees F) on the Observation_Date. From Daymet (http://daymet.ornl.gov).,
550,Tmin_Winter,Average minimum temperature (in degrees C) for the winter season of the year of the Observation_Date (December of previous year to February of the year of the Observation_Date). From Daymet (http://daymet.ornl.gov).,
560,Tmin_Spring,Average minimum temperature (in degrees C) for the spring season of the year of the Observation_Date (March-May). From Daymet (http://daymet.ornl.gov).,
570,Tmin_Summer,Average minimum temperature (in degrees C) for the summer season of the year of the Observation_Date (June-August). From Daymet (http://daymet.ornl.gov).,
580,Tmin_Fall,"Average minimum temperature (in degrees C) for the previous year's fall season (September-November), relative to the year of the Observation_Date. From Daymet (http://daymet.ornl.gov).",
590,Tmin,Minimum temperature (in degrees C) on the Observation_Date. From Daymet (http://daymet.ornl.gov).,
600,Tmin_in_F,Minimum temperature (in degrees F) on the Observation_Date. From Daymet (http://daymet.ornl.gov).,
610,Prcp_Winter,Accumulated precipitation (in mm) for the winter season of the year of the Observation_Date (December of previous year to February of the year of the Observation_Date ). From Daymet (http://daymet.ornl.gov).,
620,Prcp_Spring,Accumulated precipitation (in mm) for the spring season of the year of the Observation_Date (March-May). From Daymet (http://daymet.ornl.gov).,
630,Prcp_Summer,Accumulated precipitation (in mm) for the summer season of the year of the Observation_Date (June-August). From Daymet (http://daymet.ornl.gov).,
640,Prcp_Fall,"Accumulated precipitation (in mm) for the previous year's fall season (September-November), relative to the year of the Observation_Date. From Daymet (http://daymet.ornl.gov).",
650,Prcp,Precipitation (in mm) on the Observation_Date. From Daymet (http://daymet.ornl.gov).,
660,Accum_Prcp,Accumulated precipitation (in mm) from January 1st to the Observation_Date. From Daymet (http://daymet.ornl.gov).,
670,Daylength,Number of seconds of daylight on the Observation_Date. From Daymet (http://daymet.ornl.gov).,
710,Greenup_0,"The date, measured in number of days since January 1st, 1970, that 15% overall annual greenness is met at the location. Represents the first greenness cycle in a given year. From MCD12Q2 v006 https://lpdaac.usgs.gov/products/mcd12q2v006/",
720,Greenup_1,"The date, measured in number of days since January 1st, 1970, that 15% overall annual greenness is met at the location. Represents the second vegetation cycle in a given year. From MCD12Q2 v006 https://lpdaac.usgs.gov/products/mcd12q2v006/",
730,MidGreenup_0,"The date, measured in number of days since January 1st, 1970, that 50% overall annual greenness is met at the location. Represents the first vegetation cycle in a given year. From MCD12Q2 v006 https://lpdaac.usgs.gov/products/mcd12q2v006/",
740,MidGreenup_1,"The date, measured in number of days since January 1st, 1970, that 50% overall annual greenness is met at the location. Represents the second vegetation cycle in a given year. From MCD12Q2 v006 https://lpdaac.usgs.gov/products/mcd12q2v006/",
750,Peak_0,"The date, measured in number of days since January 1st, 1970, that maximum annual greenness is met at the location. Represents the first vegetation cycle in a given year. From MCD12Q2 v006 https://lpdaac.usgs.gov/products/mcd12q2v006/",
760,Peak_1,"The date, measured in number of days since January 1st, 1970, that maximum annual greenness is met at the location. Represents the second vegetation cycle in a given year. From MCD12Q2 v006 https://lpdaac.usgs.gov/products/mcd12q2v006/",
770,NumCycles,Total number of valid vegetation cycles with peak in product year From MCD12Q2 v006 https://lpdaac.usgs.gov/products/mcd12q2v006/,
780,Maturity_0,"The date, measured in number of days since January 1st, 1970, that 90% overall annual greenness is met at the location. Represents the first vegetation cycle in a given year. From MCD12Q2 v006 https://lpdaac.usgs.gov/products/mcd12q2v006/",
790,Maturity_1,"The date, measured in number of days since January 1st, 1970, that 90% overall annual greenness is met at the location. Represents the second vegetation cycle in a given year. From MCD12Q2 v006 https://lpdaac.usgs.gov/products/mcd12q2v006/",
800,MidGreendown_0,"The date, measured in number of days since January 1st, 1970, that 50% overall annual greenness is diminished at the location. Represents the first vegetation cycle in a given year. From MCD12Q2 v006 https://lpdaac.usgs.gov/products/mcd12q2v006/",
810,MidGreendown_1,"The date, measured in number of days since January 1st, 1970, that 50% overall annual greenness is diminished at the location. Represents the second vegetation cycle in a given year. From MCD12Q2 v006 https://lpdaac.usgs.gov/products/mcd12q2v006/",
820,Senescence_0,"The date, measured in number of days since January 1st, 1970, that 90% overall annual greenness is diminished at the location. Represents the first vegetation cycle in a given year. From MCD12Q2 v006 https://lpdaac.usgs.gov/products/mcd12q2v006/",
830,Senescence_1,"The date, measured in number of days since January 1st, 1970, that 90% overall annual greenness is diminished at the location. Represents the second vegetation cycle in a given year. From MCD12Q2 v006 https://lpdaac.usgs.gov/products/mcd12q2v006/",
840,Dormancy_0,"The date, measured in number of days since January 1st, 1970, that 15% overall annual greenness is diminished at the location. Represents the first vegetation cycle in a given year. From MCD12Q2 v006 https://lpdaac.usgs.gov/products/mcd12q2v006/",
850,Dormancy_1,"The date, measured in number of days since January 1st, 1970, that 15% overall annual greenness is diminished at the location. Represents the second vegetation cycle in a given year. From MCD12Q2 v006 https://lpdaac.usgs.gov/products/mcd12q2v006/",
860,EVI_Minimum_0,Minimum greenness value represented in the vegetation cycle. Represents the first vegetation cycle in a given year. From MCD12Q2 v006 https://lpdaac.usgs.gov/products/mcd12q2v006/,
870,EVI_Minimum_1,Minimum greenness value represented in the vegetation cycle. Represents the second vegetation cycle in a given year. From MCD12Q2 v006 https://lpdaac.usgs.gov/products/mcd12q2v006/,
880,EVI_Amplitude_0,Maximum greenness value represented in the vegetation cycle. Represents the first vegetation cycle in a given year. From MCD12Q2 v006 https://lpdaac.usgs.gov/products/mcd12q2v006/,
890,EVI_Amplitude_1,Maximum greenness value represented in the vegetation cycle. Represents the second vegetation cycle in a given year. From MCD12Q2 v006 https://lpdaac.usgs.gov/products/mcd12q2v006/,
900,EVI_Area_0,Sum of daily interpolated greenness from Greenup to Dormancy. Represents the first vegetation cycle in a given year. From MCD12Q2 v006 https://lpdaac.usgs.gov/products/mcd12q2v006/,
910,EVI_Area_1,Sum of daily interpolated greenness from Greenup to Dormancy. Represents the second vegetation cycle in a given year. From MCD12Q2 v006 https://lpdaac.usgs.gov/products/mcd12q2v006/,
920,QA_Detailed_0,"Bit-packed, SDS-specific QA codes. Represents the first vegetation cycle in a given year. From MCD12Q2 v006 https://lpdaac.usgs.gov/products/mcd12q2v006/",
930,QA_Detailed_1,"Bit-packed, SDS-specific QA codes. Represents the second vegetation cycle in a given year. From MCD12Q2 v006 https://lpdaac.usgs.gov/products/mcd12q2v006/",
940,QA_Overall_0,QA code for entire greenness segment.0 = Best; 1 = Good; 2 = Fair; 3 = Poor.  Represents the first vegetation cycle in a given year. From MCD12Q2 v006 https://lpdaac.usgs.gov/products/mcd12q2v006/,
950,QA_Overall_1,QA code for entire greenness segment.0 = Best; 1 = Good; 2 = Fair; 3 = Poor.  Represents the second vegetation cycle in a given year. From MCD12Q2 v006 https://lpdaac.usgs.gov/products/mcd12q2v006/,